{"end":"30/11/ 2023","end-fix":"2023-11-30","hospital":"Centro de Salud Mental Ameghino","id_node":"153332","job":"Psicólogos de Planta","links":["https://buenosaires.gob.ar/sites/default/files/2024-03/DI-2023-186-GCABA-DGSAM_0.pdf","https://buenosaires.gob.ar/sites/default/files/2024-03/EVALUACION_3.pdf","https://buenosaires.gob.ar/sites/default/files/2024-03/IF-2024-EVALUACION%20-GCABA-DGSAM-1-1.pdf","https://buenosaires.gob.ar/sites/default/files/2024-04/ORDEN%20DE%20MERITO-DI-2024-186-GCABA-DGSAM.pdf"],"profession":null,"specialty":"Psicólogo/a","start":"21/11/ 2023","start-fix":"2023-11-21","title":"DI-2023-186-GCABA-DGSAM","url":"https://buenosaires.gob.ar/salud/recursos-humanos/centro-de-salud-mental-ameghino-94"}
{"end":"11 de Octubre de 2024.","end-fix":"2024-10-11","hospital":"DG Docencia, Investigación y Desarrollo Profesional","id_node":"153471","job":"Pisicólogo de Planta","links":["https://buenosaires.gob.ar/sites/default/files/2024-08/DI-2024-30-GCABA-TPRPS.pdf","https://buenosaires.gob.ar/sites/default/files/2024-11/IF-2024-42765955-GCABA-TPRPS.pdf"],"profession":"Psicólogo. \r\nEspecialidad: Psicología – Salud Mental.","specialty":"Psicólogo/a","start":"30 de Septiembre de 2024","start-fix":"2024-09-30","title":"DI-2024-30-GCABA-TPRPS","url":"https://buenosaires.gob.ar/salud/recursos-humanos/talleres-protegidos-de-rehabilitacion-psicofisica"}
{"end":"30 de noviembre 2023","end-fix":"2023-11-30","hospital":"DG Salud Mental","id_node":"153353","job":"Psicólogos de Planta","links":["https://buenosaires.gob.ar/sites/default/files/2024-03/DI-2023-186-GCABA-DGSAM.pdf","https://buenosaires.gob.ar/sites/default/files/2024-03/IF-2024-EVALUACION%20-GCABA-DGSAM-1.pdf","https://buenosaires.gob.ar/sites/default/files/2024-03/IF-2024-EVALUACION-GCABA-DGSAM-1.pdf","https://buenosaires.gob.ar/sites/default/files/2024-04/IF-2024-12978503-GCABA-DGSAM%20%281%29.pdf"],"profession":"Licenciado en Psicología","specialty":"Psicólogo/a","start":"21 de noviembre 2023","start-fix":"2023-11-21","title":"DI-2023-186-GCABA-DGSAM","url":"https://buenosaires.gob.ar/salud/recursos-humanos/dg-salud-mental-97"}
{"end":"13 de diciembre de 2023","end-fix":"2023-12-13","hospital":"DG Salud Mental","id_node":"153353","job":"PSICOPEDAGOGO DE PLANTA","links":["https://buenosaires.gob.ar/sites/default/files/2024-02/DISPO%20DE%20LLAMADO-DI-2023-207-GCABA-DGSAM.pdf","https://buenosaires.gob.ar/sites/default/files/2024-02/EXAMEN-DI-2023-207-GCABA-DGSAM.pdf"],"profession":"PSICOPEDAGOGO U","specialty":"Psicólogo/a","start":"4 de diciembre de 2023","start-fix":"2023-12-04","title":"DI-2023-207-GCABA-DGSAM","url":"https://buenosaires.gob.ar/salud/recursos-humanos/dg-salud-mental-97"}
{"end":"14 de Agosto de 2024.","end-fix":"2024-08-14","hospital":"DG Salud Mental","id_node":"153353","job":"4 (cuatro) cargos de Psicólogos de Planta , para desempeñarse en el turno y equipo que se detalla a continuación: \r\n\r\n - Un cargo de Psicólogo de Planta para desempeñarse en el “turno matutino” del “Equipo Hospital de Día Infantil”. \r\n\r\n - Un cargo de Psicólogo de Planta para desempeñarse en el “turno tarde” del “Equipo de Adicciones”. \r\n\r\n - Un cargo de Psicólogo de Planta para desempeñarse en el “turno tarde” del “Equipo de Familia”. \r\n\r\n - Un cargo de Psicólogo de Planta para desempeñarse en el “turno tarde” del “Equipo de Adultos”.","links":["https://buenosaires.gob.ar/sites/default/files/2024-07/DISPO%20DE%20LLAMADO-DI-2024-115-GCABA-DGSAM.pdf","https://buenosaires.gob.ar/sites/default/files/2024-12/EXAMEN-DI-2024-115-GCABA-DGSAM.pdf","https://buenosaires.gob.ar/sites/default/files/2025-01/OM-DI-2025-115-GCABA-DGSAM.pdf"],"profession":"Licenciada/o en Psicología. Unidad Organizativa de Destino: Centro de Salud Mental N° 1 “Dr. Hugo Rosarios”. Régimen horario: 30 horas semanales de labor.","specialty":"Psicólogo/a","start":"5 de Agosto de 2024","start-fix":"2024-08-05","title":"DI-2024-115-GCABA-DGSAM","url":"https://buenosaires.gob.ar/salud/recursos-humanos/dg-salud-mental-97"}
{"end":"27 de Marzo de 2024.","end-fix":"2024-03-27","hospital":"DG Salud Mental","id_node":"153353","job":"PSICOLOGO DE PLANTA","links":["https://buenosaires.gob.ar/sites/default/files/2024-03/DISPO%20DE%20LLAMADO%20A%20CONCURSO-DI-2024-32-GCABA-DGSAM.pdf","https://buenosaires.gob.ar/sites/default/files/2024-04/EXAMEN-DI-2024-32-GCABA-DGSAM.pdf","https://buenosaires.gob.ar/sites/default/files/2024-06/IF-2024-21006867-GCABA-DGSAM%20%281%29.pdf"],"profession":"LICENCIADOS EN PSICOLOGIA","specialty":"Psicólogo/a","start":"18 de Marzo de 2024","start-fix":"2024-03-18","title":"DI-2024-32-GCABA-DGSAM","url":"https://buenosaires.gob.ar/salud/recursos-humanos/dg-salud-mental-97"}
{"end":"07/03/2025","end-fix":"2025-03-07","hospital":"DG Salud Mental","id_node":"153353","job":"tres (3) cargos de Psicólogos de Planta","links":["https://buenosaires.gob.ar/sites/default/files/2025-02/DISPO%20DE%20LLAMADO-DI-2025-16-GCABA-DGSAM.pdf","https://buenosaires.gob.ar/sites/default/files/2025-08/IF-2025-32859434-GCABA-DGSAM.pdf","https://buenosaires.gob.ar/sites/default/files/2025-08/TEMARIO-DI-2025-16-GCABA-DGSAM.pdf","https://buenosaires.gob.ar/sites/default/files/2025-10/ORDEN%20DE%20MERITO-DI-2025-16-GCABA-HGACD.pdf"],"profession":"Licenciados en Psicología Unidad Organizativa de Destino: Centro de Salud Mental Nº3 Dr Arturo Ameghino Carga horaria: 30 hs. semanales de labor (24 hs asistenciales y 6 hs de capacitación). Servicio y Turno a cubrir: para desempeñarse en el servicio “Infanto Juvenil” de lunes a viernes, distribuidos en los siguientes turnos: dos (2) cargos para cubrir el Turno Mañana y un (1) cargo para cubrir el Turno Vespertino. Finalizada la Orden de Mérito, los postulantes podrán elegir el turno a desempeñarse, respetando el orden de prelación de la misma. Lugar de Inscripción: Avda. Córdoba 3120, Centro de Salud Mental Nº3 Dr Arturo Ameghino. Horario de Inscripción: 9:00 a 12:00 hs.","specialty":"Psicólogo/a","start":"25/02/2025","start-fix":"2025-02-25","title":"DI-2025-16-GCABA-DGSAM","url":"https://buenosaires.gob.ar/salud/recursos-humanos/dg-salud-mental-97"}
{"end":"07/03/2025","end-fix":"2025-03-07","hospital":"DG Salud Mental","id_node":"153353","job":"dos (2) cargos de Psicólogos de Planta","links":["https://buenosaires.gob.ar/sites/default/files/2025-02/DISPO%20DE%20LLAMADO-DI-2025-18-GCABA-DGSAM.pdf","https://buenosaires.gob.ar/sites/default/files/2025-08/IF-2025-32859395-GCABA-DGSAM.pdf","https://buenosaires.gob.ar/sites/default/files/2025-08/TEMARIO-DI-2025-18-GCABA-DGSAM.pdf","https://buenosaires.gob.ar/sites/default/files/2025-10/ORDEN%20DE%20MERITO-DI-2025-18-GCABA-DGSAM.pdf"],"profession":"Licenciados en Psicología Unidad Organizativa de Destino: Centro de Salud Mental Nº3 Dr Arturo Ameghino Carga horaria: 30 hs. semanales de labor (24 hs asistenciales y 6 hs de capacitación). Servicio y Turno a cubrir: para desempeñarse en el servicio “Pareja y Familia”de lunes a viernes, distribuidos en los siguientes turnos: un (1) cargo para cubrir el Turno Mañana y un (1) cargo para cubrir el Turno Vespertino. Finalizada la Orden de Mérito, los postulantes podrán elegir el turno a desempeñarse, respetando el orden de prelación de la misma. Lugar de Inscripción: Avda. Córdoba 3120, Centro de Salud Mental Nº3 Dr Arturo Ameghino. Horario de Inscripción: 9:00 a 12:00 hs.","specialty":"Psicólogo/a","start":"25/02/2025","start-fix":"2025-02-25","title":"DI-2025-18-GCABA-DGSAM","url":"https://buenosaires.gob.ar/salud/recursos-humanos/dg-salud-mental-97"}
{"end":"07/03/2025","end-fix":"2025-03-07","hospital":"DG Salud Mental","id_node":"153353","job":"seis (6) cargo de Psicólogos de Planta","links":["https://buenosaires.gob.ar/sites/default/files/2025-02/DISPO%20DE%20LLAMADO-DI-2025-20-GCABA-DGSAM.pdf","https://buenosaires.gob.ar/sites/default/files/2025-08/EXAMEN-DI-2025-20-GCABA-DGSAM.pdf","https://buenosaires.gob.ar/sites/default/files/2025-08/TEMARIO-DI-2025-20-GCABA-DGSAM.pdf","https://buenosaires.gob.ar/sites/default/files/2025-10/IF-2025-43927929-GCABA-HGACD%20%287%29_0.pdf","https://buenosaires.gob.ar/sites/default/files/2025-11/IF-2025-48039730-GCABA-HGACD.pdf"],"profession":"Licenciados en Psicología Unidad Organizativa de Destino: Centro de Salud Mental Nº3 Dr Arturo Ameghino Carga horaria: 30 hs. semanales de labor (24 hs asistenciales y 6 hs de capacitación). Servicio y Turno a cubrir: para desempeñarse en el servicio “Adultos y Gerontes” de lunes a viernes, distribuidos en los siguientes turnos: dos (2) cargos para cubrir el Turno Mañana, tres (3) cargos para cubrir el Turno Tarde y un (1) cargo para cubrir el Turno Vespertino. Finalizada la Orden de Mérito, los postulantes podrán elegir el turno a desempeñarse, respetando el orden de prelación de la misma. Lugar de Inscripción: Avda. Córdoba 3120, Centro de Salud Mental Nº3 Dr Arturo Ameghino. Horario de Inscripción: 9:00 a 12:00 hs.","specialty":"Psicólogo/a","start":"25/02/2025","start-fix":"2025-02-25","title":"DI-2025-20-GCABA-DGSAM","url":"https://buenosaires.gob.ar/salud/recursos-humanos/dg-salud-mental-97"}
{"end":"27 de Junio de 2025","end-fix":"2025-06-27","hospital":"DG Salud Mental","id_node":"153353","job":"PSICOLOGO DE PLANTA","links":["https://buenosaires.gob.ar/sites/default/files/2025-06/DI-2025-22715389-GCABA-DGSAM%20%281%29.pdf","https://buenosaires.gob.ar/sites/default/files/2025-11/EXAMEN-DI-2025-81-GCABA-DGSAM.pdf"],"profession":"LICENCIADOS EN PSICOLOGIA","specialty":"Psicólogo/a","start":"17 de Junio de 2025","start-fix":"2025-06-17","title":"DI-2025-22715389-GCABA-DGSAM","url":"https://buenosaires.gob.ar/salud/recursos-humanos/dg-salud-mental-97"}
{"end":"11 de Junio de 2025.","end-fix":"2025-06-11","hospital":"DG Salud Mental","id_node":"153353","job":"PSICOLOGO DE PLANTA","links":["https://buenosaires.gob.ar/sites/default/files/2025-05/DI-2025-20937173-GCABA-DGSAM.pdf","https://buenosaires.gob.ar/sites/default/files/2025-08/EXAMEN_0.pdf","https://buenosaires.gob.ar/sites/default/files/2025-09/ORDEN%20DE%20MERITO-DI-2025-75-GCABA-DGSAM.pdf"],"profession":"LICENCIADOS EN PSICOLOGIA","specialty":"Psicólogo/a","start":"2 de Junio de 2025","start-fix":"2025-06-02","title":"DI-2025-75-GCABA-DGSAM","url":"https://buenosaires.gob.ar/salud/recursos-humanos/dg-salud-mental-97"}
{"end":"16 DE AGOSTO de 2024","end-fix":"2024-08-16","hospital":"Hosp. Gral. de Agudos B. Rivadavia","id_node":"153368","job":"PROFESIONAL PSICÓLOGO/A DE GUARDIA","links":["https://buenosaires.gob.ar/sites/default/files/2024-07/DI-2024-27603524-GCABA-HBR.pdf","https://buenosaires.gob.ar/sites/default/files/2024-11/EXAMEN-DI-2024-269-GCABA-HBR.pdf","https://buenosaires.gob.ar/sites/default/files/2024-12/IF-2024-ORDEN%20DE%20MERITO-GCABA-HBR%281%29_1.pdf"],"profession":"PSICÓLOGO/A","specialty":"Psicólogo/a","start":"05 DE AGOSTO de 2024","start-fix":"2024-08-05","title":"DI-2024-269-GCABA-HBR","url":"https://buenosaires.gob.ar/salud/recursos-humanos/hosp-gral-de-agudos-b-rivadavia-97"}
{"end":"09/05/2025","end-fix":"2025-05-09","hospital":"Hosp. Gral. de Agudos B. Rivadavia","id_node":"153368","job":"DOS (2) cargos de PROFESIONAL PSICÓLOGO/A DE PLANTA \r\n- DOS (2) Psicólogos de Planta Horario matutino y/o vespertino con 30 hs. Semanales de labor (24 horas a disposición de las tareas establecidas por el Jefe del servicio y 6 horas para capacitación).","links":["https://buenosaires.gob.ar/sites/default/files/2025-04/DISPO%20DE%20LLAMADO-DI-2025-102-GCABA-HBR.pdf","https://buenosaires.gob.ar/sites/default/files/2025-06/IF-2025-24864412-GCABA-HBR.pdf","https://buenosaires.gob.ar/sites/default/files/2025-07/ORDEN%20DE%20MERITO-DI-2025-102-GCABA-HBR.pdf"],"profession":"PSICÓLOGOS \r\n\r\n Especialidad : - \r\n\r\n Unidad Organizativa de Destino:  Hospital Bernardino Rivadavia \r\n\r\n Lugar de inscripción:  Departamento de Personal, División Dotación y Movimiento","specialty":"Psicólogo/a","start":"28/04/2025","start-fix":"2025-04-28","title":"DI-2025-102-GCABA-HBR","url":"https://buenosaires.gob.ar/salud/recursos-humanos/hosp-gral-de-agudos-b-rivadavia-97"}
{"end":"11/10/2024","end-fix":"2024-10-11","hospital":"Hosp. Gral. de Agudos Dr. A. Zubizarreta","id_node":"153372","job":"1 (un) cargo de Psicólogo de Planta","links":["https://buenosaires.gob.ar/sites/default/files/2024-09/DISPO%20DE%20LLAMADO-DI-2024-109-GCABA-HGAZ.pdf","https://buenosaires.gob.ar/sites/default/files/2025-01/DI-2024-MODIFICATORIA-155-GCABA-HGAZ-1.pdf","https://buenosaires.gob.ar/sites/default/files/2025-01/IF-2025-EVALUACI%C3%93N-DI-155-GCABA-HGAZ-3.pdf","https://buenosaires.gob.ar/sites/default/files/2025-01/IF-2025-ORDEN%20DE%20M%C3%89RITO-DI-155-GCABA-HGAZ-3.pdf"],"profession":"Psicólogo \r\n\r\n Especialidad : Psicólogo de Planta con orientación en neuropsicología","specialty":"Psicólogo/a","start":"30/09/2024","start-fix":"2024-09-30","title":"DI-2024-109-GCABA-HGAZ","url":"https://buenosaires.gob.ar/salud/recursos-humanos/hosp-gral-de-agudos-dr-zubizarreta-103"}
{"end":"17/01/2025","end-fix":"2025-01-17","hospital":"Hosp. Gral. de Agudos Dr. A. Zubizarreta","id_node":"153372","job":"Profesional de Guardia Psicología","links":["https://buenosaires.gob.ar/sites/default/files/2024-12/DI-2024-46821573-GCABA-HGAZ.pdf","https://buenosaires.gob.ar/sites/default/files/2025-06/IF-2025-24010883-GCABA-HGAZ.pdf","https://buenosaires.gob.ar/sites/default/files/2025-07/ORDEN%20DE%20MERITO-DI-2024-159-GCABA-HGACD.pdf"],"profession":"Psicólogo Especialidad: -","specialty":"Psicólogo/a","start":"06/01/2025","start-fix":"2025-01-06","title":"DI-2024-159-GCABA-HGAZ","url":"https://buenosaires.gob.ar/salud/recursos-humanos/hosp-gral-de-agudos-dr-zubizarreta-103"}
{"end":"17 de mayo 2024","end-fix":"2024-05-17","hospital":"Hosp. Gral. de Agudos Dr. C. Argerich","id_node":"153374","job":"PSICOLOGO/A DE PLANTA","links":["https://buenosaires.gob.ar/sites/default/files/2024-05/DI-2024-16058375-GCABA-HGACA.pdf","https://buenosaires.gob.ar/sites/default/files/2024-09/EXAMEN-DI-2024-257-GCABA-HGACA.pdf","https://buenosaires.gob.ar/sites/default/files/2024-09/ORDEN%20DE%20MERITO-DI-2024-257-GCABA-HGACA.pdf"],"profession":"Psicología Clínica","specialty":"Psicólogo/a","start":"06 de mayo 2024","start-fix":"2024-05-06","title":"DI-2024-257-GCABA-HGACA","url":"https://buenosaires.gob.ar/salud/recursos-humanos/hosp-gral-de-agudos-dr-c-argerich-99"}
{"end":"17 de mayo 2024","end-fix":"2024-05-17","hospital":"Hosp. Gral. de Agudos Dr. C. Argerich","id_node":"153374","job":"PSICOLOGO/A DE PLANTA","links":["https://buenosaires.gob.ar/sites/default/files/2024-05/DI-2024-16058588-GCABA-HGACA.pdf","https://buenosaires.gob.ar/sites/default/files/2024-09/EXAMEN-DI-2024-258-GCABA-HGACA.pdf","https://buenosaires.gob.ar/sites/default/files/2024-09/ORDEN%20DE%20MERITO-DI-2024-258-GCABA-HGACA.pdf"],"profession":"Psicología Clínica","specialty":"Psicólogo/a","start":"06 de mayo 2024","start-fix":"2024-05-06","title":"DI-2024-258-GCABA-HGACA","url":"https://buenosaires.gob.ar/salud/recursos-humanos/hosp-gral-de-agudos-dr-c-argerich-99"}
{"end":"18 de diciembre 2024","end-fix":"2024-12-18","hospital":"Hosp. Gral. de Agudos Dr. C. Argerich","id_node":"153374","job":"PROFESIONAL PSICOLOGO/A DE PLANTA","links":["https://buenosaires.gob.ar/sites/default/files/2024-12/DISPO%20DE%20LLAMADO-DI-2024-583-GCABA-HGACA.pdf","https://buenosaires.gob.ar/sites/default/files/2025-02/EXAMEN-DI-2024-583-GCABA-HGACA.pdf","https://buenosaires.gob.ar/sites/default/files/2025-04/ORDEN%20DE%20MERITO-DI-2024-583-GCABA-HGACA.pdf"],"profession":"Psicología Clínica \r\n\r\n Turno: vespertino. Carga horaria total: 30 (treinta) hs. semanales • Consultorios externos y Turnos espontáneos: 12 (doce) hs. semanales. • Disponibilidad en el servicio: 12 (doce) hs. semanales. • Capacitación: 06 (seis) hs. semanales. Unidad Organizativa de destino: Hospital General de Agudos Dr. Cosme Argerich Lugar de Inscripción: Oficina de Recursos Humanos HGACA. Pi y Margall 750 Subsuelo, CABA.","specialty":"Psicólogo/a","start":"04 de diciembre 2024","start-fix":"2024-12-04","title":"DI-2024-583-GCABA-HGACA","url":"https://buenosaires.gob.ar/salud/recursos-humanos/hosp-gral-de-agudos-dr-c-argerich-99"}
{"end":"18/06/2024","end-fix":"2024-06-18","hospital":"Hosp. Gral. de Agudos Dr. C. G. Durand","id_node":"153373","job":"Psicólogo de planta, con orientación en violencia intrafamiliar","links":["https://buenosaires.gob.ar/sites/default/files/2024-05/DI-2024-20501489-GCABA-HGACD.pdf","https://buenosaires.gob.ar/sites/default/files/2024-08/IF-2024-31639434-GCABA-HGACD.pdf","https://buenosaires.gob.ar/sites/default/files/2024-09/IF-2024-33441564-GCABA-HGACD.pdf"],"profession":"Profesionales \r\n\t Especialidad:  Psicólogo","specialty":"Psicólogo/a","start":"04/06/2024","start-fix":"2024-06-04","title":"DI-2024-111-GCABA-HGACD","url":"https://buenosaires.gob.ar/salud/recursos-humanos/hosp-gral-de-agudos-dr-c-g-durand-100"}
{"end":"13/02/2025","end-fix":"2025-02-13","hospital":"Hosp. Gral. de Agudos Dr. C. G. Durand","id_node":"153373","job":"Psicólogo de planta, con orientación en Niños, Niñas y Adolescentes","links":["https://buenosaires.gob.ar/sites/default/files/2025-01/DISPO%20DE%20LLAMADO-DI-2025-16-GCABA-HGACD.pdf","https://buenosaires.gob.ar/sites/default/files/2025-03/EXAMEN-DI-2025-16-GCABA-HGACD.pdf","https://buenosaires.gob.ar/sites/default/files/2025-04/IF-2025-ORDEN%20DE%20M%C3%89RITO-DI-16-GCABA-HGACD.pdf","https://buenosaires.gob.ar/sites/default/files/2025-05/DI-2025-18021697-GCABA-HGACD%20%281%29.pdf"],"profession":"Psicólogo \r\n\r\n Especialidad:  - Unidad Organizativa de destino: Hospital General de Agudos Carlos G. Durand Lugar de Inscripción: Recursos Humanos, Hospital General de Agudos Carlos G. Durand","specialty":"Psicólogo/a","start":"31/01/2025","start-fix":"2025-01-31","title":"DI-2025-16-GCABA-HGACD","url":"https://buenosaires.gob.ar/salud/recursos-humanos/hosp-gral-de-agudos-dr-c-g-durand-100"}
{"end":"20/10/2023","end-fix":"2023-10-20","hospital":"Hosp. Gral. de Agudos Dr. C. G. Durand","id_node":"153373","job":"Psicólogo de Planta","links":["https://buenosaires.gob.ar/sites/default/files/2024-03/DI-2023-221-GCABA-HGACD.pdf","https://buenosaires.gob.ar/sites/default/files/2024-03/IF-2024-EVALUACI%C3%93N-DI-221-GCABA-HGACD.pdf","https://buenosaires.gob.ar/sites/default/files/2024-03/IF-2024-10960138-GCABA-HGACD.pdf","https://buenosaires.gob.ar/sites/default/files/2024-03/DI-2024-10790666-GCABA-HGACD.pdf"],"profession":"Profesionales \r\n Especialidad : Psicólogos","specialty":"Psicólogo/a","start":"09/10/2023","start-fix":"2023-10-09","title":"DI-221-GCABA-HGACD","url":"https://buenosaires.gob.ar/salud/recursos-humanos/hosp-gral-de-agudos-dr-c-g-durand-100"}
{"end":"23 de Noviembre de 2023","end-fix":"2023-11-23","hospital":"Hosp. Gral. de Agudos Dr. E. Tornu","id_node":"153448","job":"PSICOLOGO DE GUARDIA \r\n Especialidad : PSICOLOGIA CLINICA","links":["https://buenosaires.gob.ar/sites/default/files/2024-02/DI-2023-197-GCABA-HGAT.pdf","https://buenosaires.gob.ar/sites/default/files/2024-02/IF-2024-Evaluaci%C3%B3n-DIS-197-GCABA-HGAT.pdf","https://buenosaires.gob.ar/sites/default/files/2024-04/IF-2024-ORDEN%20DE%20M%C3%89RITO-DIS-197-GCABA-HGAT-1.pdf"],"profession":"PSICOLOGO","specialty":"Psicólogo/a","start":"14 de Noviembre de 2023","start-fix":"2023-11-14","title":"DI-2023-197-GCABA-HGAT","url":"https://buenosaires.gob.ar/salud/recursos-humanos/hosp-gral-de-agudos-dr-e-tornu-99"}
{"end":"23 DE FEBRERO 2024","end-fix":"2024-02-23","hospital":"Hosp. Gral. de Agudos Dr. E. Tornu","id_node":"153448","job":"Psicólogo/a de Planta","links":["https://buenosaires.gob.ar/sites/default/files/2024-04/DI-2024-13-GCABA-HGAT.pdf","https://buenosaires.gob.ar/sites/default/files/2024-04/IF-2024-EVALUACION-GCABA-HGAT.pdf","https://buenosaires.gob.ar/sites/default/files/2024-05/IF-2024-ORDEN%20DE%20M%C3%89RITO-DI-13-GCABA-HGAT.pdf"],"profession":"PSICOLOGÍA INFANTOJUVENIL","specialty":"Psicólogo/a","start":"14 DE FEBRERO DE 2024","start-fix":"2024-02-14","title":"DI-2024-13-GCABA-HGAT","url":"https://buenosaires.gob.ar/salud/recursos-humanos/hosp-gral-de-agudos-dr-e-tornu-99"}
{"end":"18/10/24","end-fix":"2024-10-18","hospital":"Hosp. Gral. de Agudos Dr. E. Tornu","id_node":"153448","job":"PSICOLOGO DE PLANTA","links":["https://buenosaires.gob.ar/sites/default/files/2024-10/DISPO%20DE%20LLAMADO-DI-2024-162-GCABA-HGAT_0.pdf","https://buenosaires.gob.ar/sites/default/files/2024-11/EXAMEN-DI-2024-162-GCABA-HGAT.pdf","https://buenosaires.gob.ar/sites/default/files/2025-01/IF-2025-ORDEN%20DE%20MERITO-GCABA-HGAT-4.pdf"],"profession":"PSICOLOGO \r\n\r\n \r\n Orientación  : CUIDADOS PALIATIVOS Carga horaria: 30 hs. semanales -  \r\n(las que estarán distribuidas de la siguiente manera: 09  horas para la atención de Consultorios, 15 horas a disposición de las tareas establecidas por el Jefe del Servicio  y 6 horas para Capacitación)  \r\n\r\n \r\n Turno:   Matutino.","specialty":"Psicólogo/a","start":"09/10/24","start-fix":"2024-10-09","title":"DI-2024-162-GCABA-HGAT","url":"https://buenosaires.gob.ar/salud/recursos-humanos/hosp-gral-de-agudos-dr-e-tornu-99"}
{"end":"08 de Marzo de 2024.","end-fix":"2024-03-08","hospital":"Hosp. Gral. de Agudos Dr. E. Tornu","id_node":"153448","job":"Psicológo de Planta","links":["https://buenosaires.gob.ar/sites/default/files/2024-02/DI-2024-07853824-GCABA-HGAT.pdf","https://buenosaires.gob.ar/sites/default/files/2024-04/IF-2024-EVALUACION-GCABA-HGAT_1.pdf","https://buenosaires.gob.ar/sites/default/files/2024-06/DI-2024-80-GCABA-HGAT.pdf","https://buenosaires.gob.ar/sites/default/files/2024-06/IF-2024-23051415-GCABA-HGAT.pdf"],"profession":"Psicológo Especialidad Psicología Clínica.","specialty":"Psicólogo/a","start":"28 de Febrero de 2024","start-fix":"2024-02-28","title":"DI-2024-29-GCABA-HGAT","url":"https://buenosaires.gob.ar/salud/recursos-humanos/hosp-gral-de-agudos-dr-e-tornu-99"}
{"end":"20 de Marzo 2025","end-fix":"2025-03-20","hospital":"Hosp. Gral. de Agudos Dr. E. Tornu","id_node":"153448","job":"Psicólogo de Planta","links":["https://buenosaires.gob.ar/sites/default/files/2025-02/DISPO%20DE%20LLAMADO-DI-2025-39-GCABA-HGAT.pdf","https://buenosaires.gob.ar/sites/default/files/2025-06/IF-2025-EVALUACION-GCABA-HGAT-1.pdf","https://buenosaires.gob.ar/sites/default/files/2025-07/ORDEN%20DE%20MERIRO-DI-2025-39-GCABA-HGAT.pdf"],"profession":"PSICOLOGIA. Orientacion y Expertise en Infanto Juvenil Unidad Organizativa de destino: Hospital General de Agudos “ Dr. Enrique Tornu” Régimen horario: 30 hs semanales de labor. Lugar de Inscripción: Combatiente de Malvinas 3002- Oficina de Concursos- Hospital General de Agudos “ Dr. Enrique Tornu” Horario de Inscripción: 9 a 12 hs.","specialty":"Psicólogo/a","start":"11 de marzo de 2025","start-fix":"2025-03-11","title":"DI-2025-39-GCABA-HGAT","url":"https://buenosaires.gob.ar/salud/recursos-humanos/hosp-gral-de-agudos-dr-e-tornu-99"}
{"end":"10/10/2025","end-fix":"2025-10-10","hospital":"Hosp. Gral. de Agudos Dr. I. Pirovano","id_node":"153447","job":"PROFESIONAL DE PLANTA ASISTENTE DE PSICOLOGIA, CON ESPECIALIDAD EN PSICOLOGIA CLINICA","links":["https://buenosaires.gob.ar/sites/default/files/2025-09/DI-2025-39214014-GCABA-HGAIP.pdf","https://buenosaires.gob.ar/sites/default/files/2025-10/DISPO%20MODIF-DI-2025-232-GCABA-HGAIP.pdf","https://buenosaires.gob.ar/sites/default/files/2025-11/EXAMEN-DI-2025-232-GCABA-HGAIP.pdf"],"profession":"PSICOLOGA/O, CON ESPECIALIDAD EN PSICOLOGIA CLINICA","specialty":"Psicólogo/a","start":"30/09/2025","start-fix":"2025-09-30","title":"DI-2025-232-GCABA-HGAIP","url":"https://buenosaires.gob.ar/salud/recursos-humanos/hosp-gral-de-agudos-dr-i-pirovano-96"}
{"end":"31/10/2025","end-fix":"2025-10-31","hospital":"Hosp. Gral. de Agudos Dr. I. Pirovano","id_node":"153447","job":"PROFESIONAL DE GUARDIA ASISTENTE PSICLOGIA","links":["https://buenosaires.gob.ar/sites/default/files/2025-09/DI-2025-40187431-GCABA-HGAIP.pdf"],"profession":"Psicologo Especialidad : Psicología Clínica","specialty":"Psicólogo/a","start":"20/10/2025","start-fix":"2025-10-20","title":"DI-2025-239-GCABA-HGAIP","url":"https://buenosaires.gob.ar/salud/recursos-humanos/hosp-gral-de-agudos-dr-i-pirovano-96"}
{"end":"18 de Agosto 2023","end-fix":"2023-08-18","hospital":"Hosp. Gral. de Agudos Dr. J. A. Fernandez","id_node":"153453","job":"Profesional Psicología de Guardia para día sábado.","links":["https://buenosaires.gob.ar/sites/default/files/2024-03/DI-2023-202-GCABA-HGAJAF.pdf","https://buenosaires.gob.ar/sites/default/files/2024-03/IF-2024-Orden%20de%20M%C3%A9rito-DI-202-GCABA-HGAJAF.pdf"],"profession":"Profesional. \r\n Especialidad : Psicología.","specialty":"Psicólogo/a","start":"07 de Agosto 2023","start-fix":"2023-08-07","title":"DI-2023-202-GCABA-HGAJAF","url":"https://buenosaires.gob.ar/salud/recursos-humanos/hosp-gral-de-agudos-dr-j-fernandez-101"}
{"end":"15 de Mayo 2024","end-fix":"2024-05-15","hospital":"Hosp. Gral. de Agudos Dr. J. A. Fernandez","id_node":"153453","job":"Profesional Psicología Clínica de Planta","links":["https://buenosaires.gob.ar/sites/default/files/2024-05/DI-2024-141-GCABA-HGAJAF.pdf","https://buenosaires.gob.ar/sites/default/files/2024-10/EXAMEN-DI-2024-141-GCABA-HGAJAF.pdf","https://buenosaires.gob.ar/sites/default/files/2024-11/ORDEN%20DE%20MERITO_3.pdf"],"profession":"Psicología Clínica con orientación Adultos.","specialty":"Psicólogo/a","start":": 02 de Mayo 2024","start-fix":"2024-05-02","title":"DI-2024-141-GCABA-HGAJAF","url":"https://buenosaires.gob.ar/salud/recursos-humanos/hosp-gral-de-agudos-dr-j-fernandez-101"}
{"end":"17/07/2024","end-fix":"2024-07-17","hospital":"Hosp. Gral. de Agudos Dr. J. A. Fernandez","id_node":"153453","job":"Un Profesional Psicología de Guardia","links":["https://buenosaires.gob.ar/sites/default/files/2024-07/DI-2024-24771942-GCABA-HGAJAF.pdf","https://buenosaires.gob.ar/sites/default/files/2024-09/IF-2024-34061664-GCABA-HGAJAF_0.pdf","https://buenosaires.gob.ar/sites/default/files/2024-10/ORDEN%20DE%20MERITO_0_0.pdf"],"profession":"Psicología","specialty":"Psicólogo/a","start":"03/07/2024","start-fix":"2024-07-03","title":"DI-2024-204-GCABA-HGAJAF","url":"https://buenosaires.gob.ar/salud/recursos-humanos/hosp-gral-de-agudos-dr-j-fernandez-101"}
{"end":"01 de Marzo 2024.","end-fix":"2024-03-01","hospital":"Hosp. Gral. de Agudos Dr. J. A. Fernandez","id_node":"153453","job":"Profesional Psicología de Planta con orientación en Niños y Trastornos del Espectro Autista. \r\n\r\n Especialidad: Psicología con orientación en Niños y Trastornos del Espectro Autista.","links":["https://buenosaires.gob.ar/sites/default/files/2024-02/DI-2024-07464565-GCABA-HGAJAF.pdf","https://buenosaires.gob.ar/sites/default/files/2024-04/IF-2024-EVALUACI%C3%93N-DIS-34-GCABA-HGAJAF.pdf","https://buenosaires.gob.ar/sites/default/files/2024-05/IF-2024-17495312-GCABA-HGAJAF.pdf","https://buenosaires.gob.ar/sites/default/files/2024-06/IF-2024-NUEVO%20ORDEN%20DE%20MERITO-GCABA-HGAJAF-1.pdf"],"profession":null,"specialty":"Psicólogo/a","start":"19 de Febrero 2024","start-fix":"2024-02-19","title":"DI-2024-34-GCABA-HGAJAF","url":"https://buenosaires.gob.ar/salud/recursos-humanos/hosp-gral-de-agudos-dr-j-fernandez-101"}
{"end":"01 de Marzo 2024.","end-fix":"2024-03-01","hospital":"Hosp. Gral. de Agudos Dr. J. A. Fernandez","id_node":"153453","job":"Profesional Psicología de Guardia.","links":["https://buenosaires.gob.ar/sites/default/files/2024-02/DI-2024-07525751-GCABA-HGAJAF.pdf","https://buenosaires.gob.ar/sites/default/files/2024-06/IF-2024-ORDEN%20DE%20MERITO-GCABA-HGAJAF.pdf"],"profession":"Profesional // Especialidad: Psicología.","specialty":"Psicólogo/a","start":"19 de Febrero 2024","start-fix":"2024-02-19","title":"DI-2024-39-GCABA-HGAJAF","url":"https://buenosaires.gob.ar/salud/recursos-humanos/hosp-gral-de-agudos-dr-j-fernandez-101"}
{"end":"06 de Mayo 2025","end-fix":"2025-05-06","hospital":"Hosp. Gral. de Agudos Dr. J. A. Fernandez","id_node":"153453","job":"Psicóloga/o de Planta c/orientación Psicología Clínica de Adultos","links":["https://buenosaires.gob.ar/sites/default/files/2025-04/DI-2025-101-GCABA-HGAJAF.pdf","https://buenosaires.gob.ar/sites/default/files/2025-08/IF-2025-35221956-GCABA-HGAJAF.pdf"],"profession":null,"specialty":"Psicólogo/a","start":"21 de Abril 2025","start-fix":"2025-04-21","title":"DI-2025-101-GCABA-HGAJAF","url":"https://buenosaires.gob.ar/salud/recursos-humanos/hosp-gral-de-agudos-dr-j-fernandez-101"}
{"end":"29 de julio 2025","end-fix":"2025-07-29","hospital":"Hosp. Gral. de Agudos Dr. J. A. Fernandez","id_node":"153453","job":"Un Profesional Psicología de Planta con orientación terapia cognitiva conductual para la División Toxicología.","links":["https://buenosaires.gob.ar/sites/default/files/2025-07/DISPO%20DE%20LLAMADO%20-DI-2025-173-GCABA-HGAJAF.pdf","https://buenosaires.gob.ar/sites/default/files/2025-09/DI-2025-MODIFICATORIA-DI-186-GCABA-HGAJAF.pdf","https://buenosaires.gob.ar/sites/default/files/2025-09/IF-2025-EVALUACI%C3%93N-DI-186-GCABA-HGAJAF.pdf","https://buenosaires.gob.ar/sites/default/files/2025-10/ORDEN%20DE%20MERITO_1.pdf"],"profession":"Profesional. \r\n Especialidad : Psicología con orientación terapia cognitiva conductual. \r\n Unidad Organizativa de Destino : Hospital Gral. de Agudos J. A. Fernández (HGAJAF). \r\n Lugar de inscripción : Sección Concursos de Recursos Humanos del Hospital Gral. de Agudos J. A. Fernández.","specialty":"Psicólogo/a","start":"16 de julio 2025","start-fix":"2025-07-16","title":"DI-2025-173-GCABA-HGAJAF","url":"https://buenosaires.gob.ar/salud/recursos-humanos/hosp-gral-de-agudos-dr-j-fernandez-101"}
{"end":"25/10/2024","end-fix":"2024-10-25","hospital":"Hosp. Gral. de Agudos Dr. T. Alvarez","id_node":"153454","job":"01 Psicólogo/a de Planta, 30 hs. sem- para Hospital de Día- 30 hs sem- Turno Vespertino","links":["https://buenosaires.gob.ar/sites/default/files/2024-10/DI-2024-37742324-GCABA-HGATA.pdf","https://buenosaires.gob.ar/sites/default/files/2024-11/ORDEN%20DE%20MERITO-DI-2024-307-GCABA-HGATA_1.pdf"],"profession":"Psicólogo/a CON CERTIFICADO DE ESPECIALIDAD EN PSICOLOGÍA CLÍNICA y DIPLOMATURA EN HOSPITAL DE DÍA.","specialty":"Psicólogo/a","start":"14/10/2024","start-fix":"2024-10-14","title":"DI-2024-307-GCABA-HGATA","url":"https://buenosaires.gob.ar/salud/recursos-humanos/hosp-gral-de-agudos-dr-t-alvarez-97"}
{"end":"26/11/2024","end-fix":"2024-11-26","hospital":"Hosp. Gral. de Agudos Dr. T. Alvarez","id_node":"153454","job":"01 Psicólogo/a de Planta, 30 hs. sem- Consultorios Externos Adultos -Turno Vespertino","links":["https://buenosaires.gob.ar/sites/default/files/2024-11/DISPO%20DE%20LLAMADO%20-DI-2024-342-GCABA-HGATA.pdf","https://buenosaires.gob.ar/sites/default/files/2025-03/EXAMEN-DI-2024-342-GCABA-HGATA.pdf","https://buenosaires.gob.ar/sites/default/files/2025-03/ORDEN%20DE%20MERITO%20-DI-2024-342-GCABA-HGATA.pdf"],"profession":"Psicólogo/a CON CERTIFICADO DE ESPECIALIDAD EN PSICOLOGÍA CLÍNICA","specialty":"Psicólogo/a","start":"12/11/2024","start-fix":"2024-11-12","title":"DI-2024-342-GCABA-HGACA","url":"https://buenosaires.gob.ar/salud/recursos-humanos/hosp-gral-de-agudos-dr-t-alvarez-97"}
{"end":"15/03/2024","end-fix":"2024-03-15","hospital":"Hosp. Gral. de Agudos Dr. T. Alvarez","id_node":"153454","job":"01 Psicólogo/a de Planta, 30 hs. Sem-Consultorios Externos Adultos Turno Vespertino-","links":["https://buenosaires.gob.ar/sites/default/files/2024-02/DI-2024-07915654-GCABA-HGATA.pdf","https://buenosaires.gob.ar/sites/default/files/2024-04/IF-2024-EVALUACION-GCABA-HGATA%281%29.pdf","https://buenosaires.gob.ar/sites/default/files/2024-04/IF-2024-16184438-GCABA-HGATA.pdf"],"profession":"Psicólogo/a CON CERTIFICADO DE ESPECIALIDAD EN PSICOLOGÍA CLÍNICA","specialty":"Psicólogo/a","start":"04/03/2024","start-fix":"2024-03-04","title":"DI-2024-61-GCABA-HGATA","url":"https://buenosaires.gob.ar/salud/recursos-humanos/hosp-gral-de-agudos-dr-t-alvarez-97"}
{"end":"15/03/2024","end-fix":"2024-03-15","hospital":"Hosp. Gral. de Agudos Dr. T. Alvarez","id_node":"153454","job":"01 Psicólogo/a de Planta, 30 hs. sem- Con Orientación para Hospital de Día- 12 hs Turno Matutino y 12 hs Cons. Ext. Adultos Turno Vespertino","links":["https://buenosaires.gob.ar/sites/default/files/2024-02/DI-2024-08071506-GCABA-HGATA.pdf","https://buenosaires.gob.ar/sites/default/files/2024-04/IF-2024-14521045-GCABA-HGATA%20%281%29.pdf","https://buenosaires.gob.ar/sites/default/files/2024-04/IF-2024-16162156-GCABA-HGATA.pdf"],"profession":"Psicólogo/a CON CERTIFICADO DE ESPECIALIDAD EN PSICOLOGÍA CLÍNICA","specialty":"Psicólogo/a","start":"04/03/2024","start-fix":"2024-03-04","title":"DI-2024-64-GCABA-HGATA","url":"https://buenosaires.gob.ar/salud/recursos-humanos/hosp-gral-de-agudos-dr-t-alvarez-97"}
{"end":"22/03/2024","end-fix":"2024-03-22","hospital":"Hosp. Gral. de Agudos Dr. T. Alvarez","id_node":"153454","job":"1 Profesional de Guardia, Psicólogo/a","links":["https://buenosaires.gob.ar/sites/default/files/2024-03/DI-2024-08348579-GCABA-HGATA.pdf","https://buenosaires.gob.ar/sites/default/files/2024-05/EVALUACION_23.pdf","https://buenosaires.gob.ar/sites/default/files/2024-06/IF-2024-ORDEN%20DE%20M%C3%89RITO-DI-76-GCABA-HGATA.pdf"],"profession":"Psicólogo/a- CON CERTIFICADO DE ESPECIALIDAD PSICOLOGÍA CLÍNICA","specialty":"Psicólogo/a","start":"11/03/2024","start-fix":"2024-03-11","title":"DI-2024-76-GCABA-HGATA","url":"https://buenosaires.gob.ar/salud/recursos-humanos/hosp-gral-de-agudos-dr-t-alvarez-97"}
{"end":"14/02/2025","end-fix":"2025-02-14","hospital":"Hosp. Gral. de Agudos Dr. T. Alvarez","id_node":"153454","job":"Psicólogo/a de Planta","links":["https://buenosaires.gob.ar/sites/default/files/2025-01/DI-2025-5-GCABA-HGATA.pdf","https://buenosaires.gob.ar/sites/default/files/2025-05/IF-2025-17795044-GCABA-HGATA.pdf","https://buenosaires.gob.ar/sites/default/files/2025-05/IF-2025-19371447-GCABA-HGATA.pdf"],"profession":"Psicólogo/a CON CERTIFICADO DE ESPECIALIDAD   EN PSICOLOGÍA CLÍNICA Y FORMACION UNIVERSITARIA COMPROBABLE EN ADICCIONES Y EN DROGADEPENDENCIAS, CON EXPERIENCIA COMPROBABLE EN HOSPITAL DE DÍA   ADICCIONES.","specialty":"Psicólogo/a","start":"03/02/2025","start-fix":"2025-02-03","title":"DI-2025-5-GCABA-HGATA","url":"https://buenosaires.gob.ar/salud/recursos-humanos/hosp-gral-de-agudos-dr-t-alvarez-97"}
{"end":"16/05/2025","end-fix":"2025-05-16","hospital":"Hosp. Gral. de Agudos Dr. T. Alvarez","id_node":"153454","job":"01 Psicólogo/a de Planta, 30 hs. sem- Consultorios Externos Adultos -Turno Vespertino","links":["https://buenosaires.gob.ar/sites/default/files/2025-04/DI-2025-15314135-GCABA-HGATA.pdf","https://buenosaires.gob.ar/sites/default/files/2025-07/EXAMEN-DI-2025-64-GCABA-HGATA.pdf","https://buenosaires.gob.ar/sites/default/files/2025-07/IF-2025-30311863-GCABA-HGATA.pdf","https://buenosaires.gob.ar/sites/default/files/2025-10/DI-2025-237-GCABA-HGATA%281%29.pdf"],"profession":"Psicólogo/a CON CERTIFICADO DE ESPECIALIDAD EN PSICOLOGÍA CLÍNICA","specialty":"Psicólogo/a","start":"05/05/2025","start-fix":"2025-05-05","title":"DI-2025-64-GCABA-HGATA","url":"https://buenosaires.gob.ar/salud/recursos-humanos/hosp-gral-de-agudos-dr-t-alvarez-97"}
{"body":"DI-2024-30-GCABA-HGAP.pdf \n \n  Descargar","error":"match","hospital":"Hosp. Gral. de Agudos J. M. Penna","id_node":"153456","links":["https://buenosaires.gob.ar/sites/default/files/2024-04/DI-2024-30-GCABA-HGAP.pdf"],"specialty":"Psicólogo/a","title":"DI-2024-30-GCABA-HGAP","url":"https://buenosaires.gob.ar/salud/recursos-humanos/hosp-gral-de-agudos-j-m-penna-102"}
{"end":"25 de julio de 2024","end-fix":"2024-07-25","hospital":"Hosp. Gral. de Agudos J. M. Ramos Mejia","id_node":"153455","job":"Psicólogo de Planta","links":["https://buenosaires.gob.ar/sites/default/files/2024-06/DI-2024-182-GCABA-HGARM.pdf","https://buenosaires.gob.ar/sites/default/files/2024-09/IF-2024-34534366-GCABA-HGARM.pdf","https://buenosaires.gob.ar/sites/default/files/2024-10/IF-2024-ORDEN%20DE%20MERITO-GCABA-HGARM-1.pdf"],"profession":"Licenciado en Psicología","specialty":"Psicólogo/a","start":"15 de julio de 2024","start-fix":"2024-07-15","title":"DI-2024-182-GCABA-HGARM","url":"https://buenosaires.gob.ar/salud/recursos-humanos/hosp-gral-de-agudos-j-m-ramos-mejia-102"}
{"end":"11 de julio de 2024","end-fix":"2024-07-11","hospital":"Hosp. Gral. de Agudos J. M. Ramos Mejia","id_node":"153455","job":"Psicólogo de Planta","links":["https://buenosaires.gob.ar/sites/default/files/2024-06/DI-2024-24293925-GCABA-HGARM_0.pdf","https://buenosaires.gob.ar/sites/default/files/2024-09/IF-2024-35580477-GCABA-HGARM.pdf","https://buenosaires.gob.ar/sites/default/files/2024-10/IF-2024-ORDEN%20DE%20M%C3%89RITO-DI-196-GCABA-HGARM.pdf"],"profession":"Lic. en Psicología","specialty":"Psicólogo/a","start":"10 de julio de 2024","start-fix":"2024-07-10","title":"DI-2024-196-GCABA-HGARM","url":"https://buenosaires.gob.ar/salud/recursos-humanos/hosp-gral-de-agudos-j-m-ramos-mejia-102"}
{"end":"12 de abril de 2024","end-fix":"2024-04-12","hospital":"Hosp. Gral. de Agudos J. M. Ramos Mejia","id_node":"153455","job":null,"links":["https://buenosaires.gob.ar/sites/default/files/2024-03/DI-2024-10610060-GCABA-HGARM.pdf"],"profession":"Lic. en Psicología","specialty":"Psicólogo/a","start":"03 de abril de 2024","start-fix":"2024-04-03","title":"DI-2024-65-GCABA-HGARM","url":"https://buenosaires.gob.ar/salud/recursos-humanos/hosp-gral-de-agudos-j-m-ramos-mejia-102"}
{"end":"22/11/2023","end-fix":"2023-11-22","hospital":"Hosp. Gral. de Agudos P. Piñeiro","id_node":"153457","job":"1 CARGO DE PROFESIONAL DE GUARDIA PSICOLOGO.","links":["https://buenosaires.gob.ar/sites/default/files/2024-10/DI-2023-39517303-GCABA-HGAPP.pdf","https://buenosaires.gob.ar/sites/default/files/2024-11/IF-2024-44937094-GCABA-HGAPP.pdf","https://buenosaires.gob.ar/sites/default/files/2024-12/ORDEN%20DE%20MERITO-DI-2024-561-GCABA-HGAPP.pdf"],"profession":"PSICOLOGO.","specialty":"Psicólogo/a","start":"08/11/2023","start-fix":"2023-11-08","title":"DI-2023-510-GCABA-HGAPP","url":"https://buenosaires.gob.ar/salud/recursos-humanos/hosp-gral-de-agudos-p-pineiro-0"}
{"end":"03/07/2024","end-fix":"2024-07-03","hospital":"Hosp. Gral. de Agudos P. Piñeiro","id_node":"153457","job":"1 CARGO DE PSICOLOGO DE PLANTA CON ORIENTACION INFANTO JUVENIL","links":["https://buenosaires.gob.ar/sites/default/files/2024-06/DI-2024-22121117-GCABA-HGAPP.pdf","https://buenosaires.gob.ar/sites/default/files/2024-10/EXAMEN-DI-2024-328-GCABA-HGAPP.pdf","https://buenosaires.gob.ar/sites/default/files/2024-10/IF-2024-40345448-GCABA-HGAPP.pdf"],"profession":"PSICOLOGO Orientación: INFANTO JUVENIL","specialty":"Psicólogo/a","start":"18/06/2024","start-fix":"2024-06-18","title":"DI-2024-328-GCABA-HGAPP","url":"https://buenosaires.gob.ar/salud/recursos-humanos/hosp-gral-de-agudos-p-pineiro-0"}
{"end":"24/01/2025","end-fix":"2025-01-24","hospital":"Hosp. Gral. de Agudos P. Piñeiro","id_node":"153457","job":"Profesional de Guardia","links":["https://buenosaires.gob.ar/sites/default/files/2024-12/DI-2024-712-GCABA-HGAPP.pdf","https://buenosaires.gob.ar/sites/default/files/2025-06/IF-2025-23852493-GCABA-HGAPP%20%281%29.pdf","https://buenosaires.gob.ar/sites/default/files/2025-07/ORDEN%20DE%20MERITO-DI-2024-712-GCABA-HGAPP.pdf"],"profession":"Psicólogo","specialty":"Psicólogo/a","start":"3/01/2025","start-fix":"2025-01-03","title":"DI-2024-712-GCABA-HGAPP","url":"https://buenosaires.gob.ar/salud/recursos-humanos/hosp-gral-de-agudos-p-pineiro-0"}
{"end":"26/09/2025","end-fix":"2025-09-26","hospital":"Hosp. Gral. de Agudos P. Piñeiro","id_node":"153457","job":"PSICOLOGO \r\n\r\n Unidad Organizativa de destino:  Hospital General de Agudos “Parmenio Piñero” \r\n\r\n Carga Horaria Semanal: \r\n24 HORAS INTERCONSULTAS INFANTO JUVENIL \r\n6 HORAS DE CAPACITACION \r\n\r\n Lugar de Inscripción:  Av. Varela 1301, Pabellón de Guardia, 2° Piso, Oficina de Concurso y Designaciones","links":["https://buenosaires.gob.ar/sites/default/files/2025-09/DISPO%20DE%20LLAMADO-DI-2025-399-GCABA-HGAPP.pdf"],"profession":null,"specialty":"Psicólogo/a","start":"15/09/2025","start-fix":"2025-09-15","title":"DI-2025-399-GCABA-HGAPP","url":"https://buenosaires.gob.ar/salud/recursos-humanos/hosp-gral-de-agudos-p-pineiro-0"}
{"end":"20/09/2024","end-fix":"2024-09-20","hospital":"Hosp. Gral. de Niños Dr. R. Gutiérrez","id_node":"153458","job":"1 (un) cargo como Psicólogo de planta (infanto juvenil)","links":["https://buenosaires.gob.ar/sites/default/files/2024-08/DI-2024-254-GCABA-HGNRG.pdf","https://buenosaires.gob.ar/sites/default/files/2024-10/examen.pdf","https://buenosaires.gob.ar/sites/default/files/2024-11/IF-2024-EVALUACION-GCABA-HGNRG_0.pdf","https://buenosaires.gob.ar/sites/default/files/2024-12/IF-2024-ORDEN%20DE%20MERITO-GCABA-HGNRG-2.pdf","https://buenosaires.gob.ar/sites/default/files/2025-01/DI-2025-AMPLIATORIA%20-4-GCABA-HGNRG.pdf"],"profession":"Psicólogo especialista en infanto juvenil","specialty":"Psicólogo/a","start":"11/09/2024","start-fix":"2024-09-11","title":"DI-2024-254-GCABA-HGNRG","url":"https://buenosaires.gob.ar/salud/recursos-humanos/hosp-gral-de-ninos-dr-r-gutierrez-103"}
{"end":"20/12/2024","end-fix":"2024-12-20","hospital":"Hosp. Gral. de Niños P. de Elizalde","id_node":"153459","job":"Un cargo de Psicólogo/a de planta con 30hs semanales de labor horario vespertino equipo escolar.","links":["https://buenosaires.gob.ar/sites/default/files/2024-12/DISPO%20DE%20LLAMADO-DI-2024-292-GCABA-HGNPE.pdf","https://buenosaires.gob.ar/sites/default/files/2025-02/EXAMEN%20-DI-2024-292-GCABA-HGNPE.pdf","https://buenosaires.gob.ar/sites/default/files/2025-02/ORDEN%20DE%20MERITO-DI-2024-292-GCABA-HGNPE.pdf"],"profession":"Licenciado/a en Psicología Unidad Organizativa de destino: HGNPE Lugar de Inscripción: Av. Montes de Oca 40. CABA.","specialty":"Psicólogo/a","start":"09/12/2024","start-fix":"2024-12-09","title":"DI-2024-292-GCABA-HGNPE","url":"https://buenosaires.gob.ar/salud/recursos-humanos/hosp-gral-de-ninos-p-de-elizalde-103"}
{"end":"18/03/2025","end-fix":"2025-03-18","hospital":"Hosp. Gral. de Niños P. de Elizalde","id_node":"153459","job":null,"links":["https://buenosaires.gob.ar/sites/default/files/2025-03/DISPO%20DE%20LLAMADO-DI-2025-29-GCABA-HGNPE.pdf","https://buenosaires.gob.ar/sites/default/files/2025-06/EXAMEN_3.pdf","https://buenosaires.gob.ar/sites/default/files/2025-07/ORDEN%20DE%20MERITO-DI-2025-29-GCABA-HGNPE.pdf"],"profession":"Licenciado en Psicología \r\n\r\n Requisitos:  Residencia en Psicología infanto-juvenil en el GCBA Unidad Organizativa de destino: HGNPE Lugar de Inscripción: Av. Montes de Oca 40. CABA.","specialty":"Psicólogo/a","start":"05/03/2025","start-fix":"2025-03-05","title":"DI-2025-29-GCABA-HGNPE","url":"https://buenosaires.gob.ar/salud/recursos-humanos/hosp-gral-de-ninos-p-de-elizalde-103"}
{"end":"14/04/2025.","end-fix":"2025-04-14","hospital":"Hosp. Gral. de Niños P. de Elizalde","id_node":"153459","job":"Psicóloga/o de Planta, con 30 hs. semanales de labor.","links":["https://buenosaires.gob.ar/sites/default/files/2025-03/DISPO%20DE%20LLAMADO-DI-2025-46-GCABA-HGNPE.pdf","https://buenosaires.gob.ar/sites/default/files/2025-08/EXAMEN-DI-2025-46-GCABA-HGNPE.pdf","https://buenosaires.gob.ar/sites/default/files/2025-08/IF-2025-ORDEN%20DE%20MERITO-GCABA-HGNPE%283%29.pdf"],"profession":"Psicólogo/a. \r\n\r\n Requisitos:  Formación en Psicología Clínica Infanto Juvenil. \r\n\r\n Unidad Organizativa de destino : HGNPE \r\n\r\n Lugar de Inscripción:  Av. Montes de Oca 40 (CABA).","specialty":"Psicólogo/a","start":"31/03/2025","start-fix":"2025-03-31","title":"DI-2025-46-GCABA-HGNPE","url":"https://buenosaires.gob.ar/salud/recursos-humanos/hosp-gral-de-ninos-p-de-elizalde-103"}
{"end":"14/04/2025","end-fix":"2025-04-14","hospital":"Hosp. Gral. de Niños P. de Elizalde","id_node":"153459","job":"Psicóloga/o de Guardia, con 30 hs. semanales de labor.","links":["https://buenosaires.gob.ar/sites/default/files/2025-03/DISPO%20DE%20LLAMADO-DI-2025-47-GCABA-HGNPE.pdf","https://buenosaires.gob.ar/sites/default/files/2025-06/IF-2025-EVALUACION-GCABA-HGNPE-2.pdf","https://buenosaires.gob.ar/sites/default/files/2025-07/NUEVA%20FECHA%20DE%20EXAMEN.pdf","https://buenosaires.gob.ar/sites/default/files/2025-07/ORDEN%20DE%20MERITO-DI-2025-47-GCABA-HGNPE.pdf"],"profession":"Psicólogo/a. Requisitos: Formación en Psicología Clínica Infanto Juvenil. Unidad Organizativa de destino: HGNPE Lugar de Inscripción: Av. Montes de Oca 40 (CABA).","specialty":"Psicólogo/a","start":"31/03/2025","start-fix":"2025-03-31","title":"DI-2025-47-GCABA-HGNPE","url":"https://buenosaires.gob.ar/salud/recursos-humanos/hosp-gral-de-ninos-p-de-elizalde-103"}
{"end":"26/06/2024","end-fix":"2024-06-26","hospital":"Hosp. Infanto Juvenil Dra. C. Tobar García","id_node":"153460","job":"Profesional de la Salud Lic. Psicólogo/a de planta","links":["https://buenosaires.gob.ar/sites/default/files/2024-05/DI-2024-11-GCABA-HIJCTG.pdf","https://buenosaires.gob.ar/sites/default/files/2024-09/IF-2024-31818516-GCABA-HIJCTG.pdf","https://buenosaires.gob.ar/sites/default/files/2024-09/IF-2024-34573514-GCABA-HIJCTG.pdf","https://buenosaires.gob.ar/sites/default/files/2024-09/DI-2024-41-GCABA-HIJCTG%281%29.pdf"],"profession":"Lic. Psicólogo/a","specialty":"Psicólogo/a","start":"10/06/2024","start-fix":"2024-06-10","title":"DI-2024-11-GCABA-HIJCTG","url":"https://buenosaires.gob.ar/salud/recursos-humanos/hosp-infanto-juvenil-dra-c-tobar-garcia-98"}
{"end":"13/09/2024","end-fix":"2024-09-13","hospital":"Hosp. Infanto Juvenil Dra. C. Tobar García","id_node":"153460","job":"Lic. Psicólogo/a, con Formación y Experiencia comprobable en espacios de Orientación Vocacional. Horarios a cubrir: 30 hs. \r\n\r\n Turno:  Matutino y Vespertino en horario rotativos, de 08:00:00 a 14:00 horas, 12:00:00 a 18:00 horas","links":["https://buenosaires.gob.ar/sites/default/files/2024-08/DISPO%20DE%20LLMADO-DI-2024-31-GCABA-HIJCTG_0.pdf"],"profession":"Lic. Psicólogo/a","specialty":"Psicólogo/a","start":"02/09/2024","start-fix":"2024-09-02","title":"DI-2024-31-GCABA-HIJCTG","url":"https://buenosaires.gob.ar/salud/recursos-humanos/hosp-infanto-juvenil-dra-c-tobar-garcia-98"}
{"end":"16/05/2025","end-fix":"2025-05-16","hospital":"Hosp. Infanto Juvenil Dra. C. Tobar García","id_node":"153460","job":"Profesional Titular de Guardia – Día Sábado","links":["https://buenosaires.gob.ar/sites/default/files/2025-04/DISPO%20DE%20LLAMADO-DI-2025-13-GCABA-HIJCTG.pdf","https://buenosaires.gob.ar/sites/default/files/2025-07/IF-2025-ORDEN%20DE%20M%C3%89RITO-DI-13-GCABA-HIJCTG.pdf"],"profession":"Lic. Psicólogo/a \r\n\r\n Unidad Organizativa de destino:  Hospital Infanto Juvenil “Dra. Carolina Tobar García” \r\n\r\n Lugar de Inscripción : Recursos Humanos, Of. Concursos 4° Piso de este efector de Salud.","specialty":"Psicólogo/a","start":"05/05/2025","start-fix":"2025-05-05","title":"DI-2025-13-GCABA-HIJCTG","url":"https://buenosaires.gob.ar/salud/recursos-humanos/hosp-infanto-juvenil-dra-c-tobar-garcia-98"}
{"end":"18/08/2025","end-fix":"2025-08-18","hospital":"Hosp. Infanto Juvenil Dra. C. Tobar García","id_node":"153460","job":"Profesional de la Salud Lic. Psicólogo/a de planta","links":["https://buenosaires.gob.ar/sites/default/files/2025-07/DI-2025-28167857-GCABA-HIJCTG.pdf","https://buenosaires.gob.ar/sites/default/files/2025-09/IF-2025-40570957-GCABA-HIJCTG.pdf","https://buenosaires.gob.ar/sites/default/files/2025-09/IF-2025-40571584-GCABA-HIJCTG.pdf"],"profession":"Lic. Psicólogo/a Perfil: Con formación y/o trayectoria probada en dispositivos Grupales de APS y comunicacional.","specialty":"Psicólogo/a","start":"04/08/2025","start-fix":"2025-08-04","title":"DI-2025-32-GCABA-HIJCTG","url":"https://buenosaires.gob.ar/salud/recursos-humanos/hosp-infanto-juvenil-dra-c-tobar-garcia-98"}
{"end":"30/12/2024","end-fix":"2024-12-30","hospital":"Hosp. Materno Infantil R. Sarda","id_node":"153461","job":"Psicólogo de planta","links":["https://buenosaires.gob.ar/sites/default/files/2024-12/IF-2024-46957272-GCABA-HMIRS.pdf","https://buenosaires.gob.ar/sites/default/files/2025-02/ORDEN%20DE%20MERITO-DI-2024-261-GCABA-HMIRS.pdf"],"profession":"Psicólogo/a \r\n\r\n Especialidad:  Con orientación en alto riesgo perinatal","specialty":"Psicólogo/a","start":"20/12/2024","start-fix":"2024-12-20","title":"D1-2024-26 l-GCABA-HMIRS","url":"https://buenosaires.gob.ar/salud/recursos-humanos/hosp-materno-infantil-r-sarda-95"}
{"end":"8 de mayo de 2025","end-fix":"2025-05-08","hospital":"Hosp. Mpal. de Oncologia Marie Curie","id_node":"153462","job":"PSICÓLOGO DE PLANTA","links":["https://buenosaires.gob.ar/sites/default/files/2025-04/DI-2025-83-GCABA-HMOMC.pdf","https://buenosaires.gob.ar/sites/default/files/2025-04/DI-2025-16342066-GCABA-HMOMC.pdf","https://buenosaires.gob.ar/sites/default/files/2025-05/IF-2025-22213669-GCABA-HMOMC.pdf","https://buenosaires.gob.ar/sites/default/files/2025-06/IF-2025-23373071-GCABA-HMOMC.pdf"],"profession":"con orientación en CUIDADOS PALIATIVOS","specialty":"Psicólogo/a","start":"23 de abril de 2025","start-fix":"2025-04-23","title":"DI-2025-83-GCABA-HMOMC","url":"https://buenosaires.gob.ar/salud/recursos-humanos/hosp-mpal-de-oncologia-marie-curie-95"}
{"end":"17/05/2024","end-fix":"2024-05-17","hospital":"Hosp. de Emergencias Psiquiátricas T. de Alvear","id_node":"153354","job":"Psicólogo de Planta","links":["https://buenosaires.gob.ar/sites/default/files/2024-04/DI-2024-16006657-GCABA-HEPTA.pdf","https://buenosaires.gob.ar/sites/default/files/2024-06/DI-2024-26-GCABA-HEPTA.pdf","https://buenosaires.gob.ar/sites/default/files/2024-07/IF-2024-27572417-GCABA-HEPTA.pdf","https://buenosaires.gob.ar/sites/default/files/2024-08/IF-2024-ORDEN%20DE%20MERITO-GCABA-HEPTA-1.pdf","https://buenosaires.gob.ar/sites/default/files/2024-12/DI-2024-AMPLIATORIA-67-GCABA-HEPTA-3.pdf"],"profession":"Lic. en Psicología - Psicología Clínica","specialty":"Psicólogo/a","start":"06/05/2024","start-fix":"2024-05-06","title":"DI-2024-14-GCABA-HEPTA","url":"https://buenosaires.gob.ar/salud/recursos-humanos/hosp-de-emergencias-psiquiatricas-t-de-alvear-91"}
{"end":"27/06/2025","end-fix":"2025-06-27","hospital":"Hosp. de Emergencias Psiquiátricas T. de Alvear","id_node":"153354","job":"2 (dos) Profesional Psicólogo de Guardia","links":["https://buenosaires.gob.ar/sites/default/files/2025-06/DI-2025-23958112-GCABA-HEPTA.pdf","https://buenosaires.gob.ar/sites/default/files/2025-11/IF-2025-48990704-GCABA-HEPTA%20%281%29.pdf"],"profession":"Lic. en Psicología","specialty":"Psicólogo/a","start":"17/06/2025","start-fix":"2025-06-17","title":"DI-2025-34-GCABA-HEPTA","url":"https://buenosaires.gob.ar/salud/recursos-humanos/hosp-de-emergencias-psiquiatricas-t-de-alvear-91"}
{"end":"27/06/2025","end-fix":"2025-06-27","hospital":"Hosp. de Emergencias Psiquiátricas T. de Alvear","id_node":"153354","job":"2 (dos) Profesional Psicólogo de Guardia","links":["https://buenosaires.gob.ar/sites/default/files/2025-06/DI-2025-23991187-GCABA-HEPTA.pdf","https://buenosaires.gob.ar/sites/default/files/2025-11/IF-2025-48990704-GCABA-HEPTA_1.pdf"],"profession":"Lic. en Psicología Especialidad: Psicología Clínica","specialty":"Psicólogo/a","start":"17/06/2025","start-fix":"2025-06-17","title":"DI-2025-36-GCABA-HEPTA","url":"https://buenosaires.gob.ar/salud/recursos-humanos/hosp-de-emergencias-psiquiatricas-t-de-alvear-91"}
{"end":"18/01/2024","end-fix":"2024-01-18","hospital":"Hosp. de Quemados Dr. A. U. Illia","id_node":"153360","job":"psicóloga/o de planta","links":["https://buenosaires.gob.ar/sites/default/files/2024-03/DI-2023-206-GCABA-HQ.pdf","https://buenosaires.gob.ar/sites/default/files/2024-03/IF-2024-EVALUACION-GCABA-HQ.pdf","https://buenosaires.gob.ar/sites/default/files/2024-03/IF-2024-12006240-GCABA-HQ.pdf"],"profession":"psicóloga/o","specialty":"Psicólogo/a","start":"05/01/2024","start-fix":"2024-01-05","title":"DI-2023-206-GCABA-HQ","url":"https://buenosaires.gob.ar/salud/recursos-humanos/hosp-de-quemados-dr-u-illia-96"}
{"end":"18/01/2024","end-fix":"2024-01-18","hospital":"Hosp. de Quemados Dr. A. U. Illia","id_node":"153360","job":"psicóloga/o de planta","links":["https://buenosaires.gob.ar/sites/default/files/2024-03/DI-2023-208-GCABA-HQ.pdf","https://buenosaires.gob.ar/sites/default/files/2024-03/IF-2024-EVALUACION-GCABA-HQ-1.pdf","https://buenosaires.gob.ar/sites/default/files/2024-03/IF-2024-12006240-GCABA-HQ_0.pdf"],"profession":"psicóloga","specialty":"Psicólogo/a","start":"05/01/2024","start-fix":"2024-01-05","title":"DI-2023-208-GCABA-HQ","url":"https://buenosaires.gob.ar/salud/recursos-humanos/hosp-de-quemados-dr-u-illia-96"}
{"end":"23 de Febrero de 2024","end-fix":"2024-02-23","hospital":"Hosp. de Salud Mental Dr. B.    Moyano","id_node":"153363","job":"Dos vacantes de psicología de planta \r\n\t Especialidad : Psicología Clínica","links":["https://buenosaires.gob.ar/sites/default/files/2024-03/DI-2024-00967323-GCABA-HNBM.pdf","https://buenosaires.gob.ar/sites/default/files/2024-03/DI-2024-01019475-GCABA-HNBM.pdf","https://buenosaires.gob.ar/sites/default/files/2024-03/IF-2024-10203941-GCABA-HNBM.pdf","https://buenosaires.gob.ar/sites/default/files/2024-03/IF-2024-11294355-GCABA-HNBM.pdf"],"profession":null,"specialty":"Psicólogo/a","start":"12 de Febrero de 2024","start-fix":"2024-02-12","title":"DI-2024-4-GCABA-HNBM","url":"https://buenosaires.gob.ar/salud/recursos-humanos/hosp-de-salud-mental-dr-b-moyano-94"}
{"end":"21 de agosto de 2025","end-fix":"2025-08-21","hospital":"Hosp. de Salud Mental Dr. B.    Moyano","id_node":"153363","job":"Psicólogo/a de Planta","links":["https://buenosaires.gob.ar/sites/default/files/2025-07/DI-2025-28397822-GCABA-HNBM.pdf","https://buenosaires.gob.ar/sites/default/files/2025-09/EXAMEN-DI-2025-93-GCABA-HNBM_0.pdf","https://buenosaires.gob.ar/sites/default/files/2025-10/ORDEN%20DE%20MERITO-DI-2025-93-GCABA-HNBM.pdf"],"profession":"Lic. Psicología Psicología Clínica","specialty":"Psicólogo/a","start":"11 de agosto de 2025","start-fix":"2025-08-11","title":"DI-2025-93-GCABA-HNBM","url":"https://buenosaires.gob.ar/salud/recursos-humanos/hosp-de-salud-mental-dr-b-moyano-94"}
{"end":"06/12/2024","end-fix":"2024-12-06","hospital":"Hosp. de Salud Mental Dr. J. T. Borda","id_node":"153364","job":"Psicólogo de planta Carga horaria 30 hs \r\n\r\n Turno : Matutino, (12 horas para la atención ambulatoria, 12 horas a disposición de las tareas establecidas por el jefe de servicio y 6 horas para capacitación)","links":["https://buenosaires.gob.ar/sites/default/files/2024-11/DISPO%20DE%20LLAMADO-DI-2024-105-GCABA-HNJTB.pdf","https://buenosaires.gob.ar/sites/default/files/2025-02/EXAMEN-DI-2024-105-GCABA-HNJTB.pdf","https://buenosaires.gob.ar/sites/default/files/2025-03/ORDEN%20DE%20MERITO-DI-2024-105-GCABA-HNJTB.pdf","https://buenosaires.gob.ar/sites/default/files/2025-05/DI-2025-17740088-GCABA-HNJTB.pdf"],"profession":"Psicólogo \r\n\r\n Especialidad:  Psicología clínica Unidad Organizativa de destino: Hospital Neuropsiquiátrico “José T. Borda” Lugar Inscripción: Ramón Carrillo 375 – Departamento de Personal Horario de Inscripción: Lunes a Viernes de 10 a 12 hs.","specialty":"Psicólogo/a","start":"25/11/2024","start-fix":"2024-11-25","title":"DI-2024-105-GCABA-HNJTB","url":"https://buenosaires.gob.ar/salud/recursos-humanos/hosp-de-salud-mental-dr-j-t-borda-93"}
{"end":"05/07/2024","end-fix":"2024-07-05","hospital":"Hosp. de Salud Mental Dr. J. T. Borda","id_node":"153364","job":"Psicólogo de Planta \r\n Turno : Matutino (12 horas para la atención ambulatoria, 12 horas a disposición de las tareas establecidas \r\npor el jefe de servicio y 6 horas para capacitación)","links":["https://buenosaires.gob.ar/sites/default/files/2024-06/DI-2024-54-GCABA-HNJTB.pdf","https://buenosaires.gob.ar/sites/default/files/2024-09/EXAMEN-DI-2024-54-GCABA-HNJTB.pdf","https://buenosaires.gob.ar/sites/default/files/2024-10/ORDEN%20DE%20MERITO_7.pdf"],"profession":"Psicólogo \r\n Especialidad : Psicología Clínica","specialty":"Psicólogo/a","start":"24/06/2024","start-fix":"2024-06-24","title":"DI-2024-54-GCABA-HNJTB","url":"https://buenosaires.gob.ar/salud/recursos-humanos/hosp-de-salud-mental-dr-j-t-borda-93"}
{"end":"05/07/2024","end-fix":"2024-07-05","hospital":"Hosp. de Salud Mental Dr. J. T. Borda","id_node":"153364","job":"Psicólogo de Planta \r\nTurno: Matutino, (12 horas para la atención ambulatoria, 12 horas a disposición de las tareas establecidas por el jefe de servicio y 6 horas para capacitación) \r\nUnidad Organizativa de destino: Hospital Neuropsiquiátrico “José T. Borda” \r\nLugar Inscripción: Ramón Carrillo 375 – Departamento de Personal \r\nHorario de Inscripción: Lunes a Viernes de 10 a 12 hs.","links":["https://buenosaires.gob.ar/sites/default/files/2024-06/DI-2024-55-GCABA-HNJTB.pdf","https://buenosaires.gob.ar/sites/default/files/2024-07/EXAMEN-DI-2024-55-GCABA-HNJTB.pdf","https://buenosaires.gob.ar/sites/default/files/2024-08/ORDEN%20DE%20MERITO-DI-2024-55-GCABA-HNJTB.pdf"],"profession":null,"specialty":"Psicólogo/a","start":"24/06/2024","start-fix":"2024-06-24","title":"DI-2024-55-GCABA-HNJTB","url":"https://buenosaires.gob.ar/salud/recursos-humanos/hosp-de-salud-mental-dr-j-t-borda-93"}
{"end":"05/07/2024","end-fix":"2024-07-05","hospital":"Hosp. de Salud Mental Dr. J. T. Borda","id_node":"153364","job":"Psicólogo de Planta Carga horaria 30 hs Turno: Matutino ,( 12 horas para la atención de Ambulatoria , 12 horas a disposición de las tareas establecidas por el jefe de servicio y 6 horas para capacitación)","links":["https://buenosaires.gob.ar/sites/default/files/2024-06/DISPO%20DE%20LLAMADO-DI-2024-58-GCABA-HNJTB.pdf","https://buenosaires.gob.ar/sites/default/files/2024-10/DI-2024-101-GCABA-HNJTB.pdf"],"profession":"Psicólogo \r\n\r\n Especialidad:  Psicología Clínica","specialty":"Psicólogo/a","start":"24/06/2024","start-fix":"2024-06-24","title":"DI-2024-58-GCABA-HNJTB","url":"https://buenosaires.gob.ar/salud/recursos-humanos/hosp-de-salud-mental-dr-j-t-borda-93"}
{"end":"05/07/2024","end-fix":"2024-07-05","hospital":"Hosp. de Salud Mental Dr. J. T. Borda","id_node":"153364","job":"Psicólogo de Planta Carga horaria 30 hs Turno: Matutino (12 horas para la atención de ambulatoria, 12 horas a disposición de las tareas establecidas por el jefe de servicio y 6 horas para capacitación)","links":["https://buenosaires.gob.ar/sites/default/files/2024-06/DISPO%20DE%20LLAMADO-DI-2024-60-GCABA-HNJTB.pdf","https://buenosaires.gob.ar/sites/default/files/2024-08/IF-2024-29180194-GCABA-HNJTB.pdf","https://buenosaires.gob.ar/sites/default/files/2024-09/IF-2024-ORDEN%20DE%20M%C3%89RITO-DI-60-GCABA-HNJTB.pdf"],"profession":"Psicólogo \r\n\r\n Especialidad:  Psicología Clínica","specialty":"Psicólogo/a","start":"24/06/2024","start-fix":"2024-06-24","title":"DI-2024-60-GCABA-HNJTB","url":"https://buenosaires.gob.ar/salud/recursos-humanos/hosp-de-salud-mental-dr-j-t-borda-93"}
{"end":"18 de octubre de 2024","end-fix":"2024-10-18","hospital":"Hosp.de Rehabilitacion M. Rocca","id_node":"153361","job":"Psicologa/o de Planta.","links":["https://buenosaires.gob.ar/sites/default/files/2024-10/DISPO%20DE%20LLAMADO-DI-2024-111-GCABA-HRR.pdf","https://buenosaires.gob.ar/sites/default/files/2024-12/ORDEND%20DE%20MERITO-DI-2024-111-GCABA-HRR.pdf"],"profession":"Lic.en Psicologia \r\n\r\n Experiencia : En manejo fluido de lengua de señas Argentina (LSA) y atención de pacientes con discapacidad.","specialty":"Psicólogo/a","start":"09 de octubre de 2024","start-fix":"2024-10-09","title":"DI-2024-111-GCABA-HRR","url":"https://buenosaires.gob.ar/salud/recursos-humanos/hospde-rehabilitacion-m-rocca-95"}
{"end":"12 de Junio de 2024.","end-fix":"2024-06-12","hospital":"Hosp.de Rehabilitacion M. Rocca","id_node":"153361","job":"Uno (1) Psicologa/o de Planta.","links":["https://buenosaires.gob.ar/sites/default/files/2024-06/DISPO%20DE%20LLAMADO-DI-2024-68-GCABA-HRR.pdf","https://buenosaires.gob.ar/sites/default/files/2024-09/ORDEN%20DE%20MERITO-DI-2024-68-GCABA-HRR_0.pdf"],"profession":"Lic.en Psicologa/o \r\n\r\n Experiencia: En manejo fluido de lengua de señas Argentina (LSA) y atención de pacientes con discapacidad.","specialty":"Psicólogo/a","start":"03 de junio de 2024","start-fix":"2024-06-03","title":"DI-2024-68-GCABA-HRR","url":"https://buenosaires.gob.ar/salud/recursos-humanos/hospde-rehabilitacion-m-rocca-95"}
{"end":"21/03/2025.","end-fix":"2025-03-21","hospital":"SS Atención Hospitalaria","id_node":"153469","job":"Psicólogo/a de Planta.","links":["https://buenosaires.gob.ar/sites/default/files/2025-03/RESOL%20DE%20LLAMADO-RS-2025-35-GCABA-SSAH.pdf","https://buenosaires.gob.ar/sites/default/files/2025-03/SUSPENSI%C3%93N%20DE%20LLAMADO-RS-2025-45-GCABA-SSAH_0.pdf","https://buenosaires.gob.ar/sites/default/files/2025-04/RESOL-2025-59-NULIDAD-SSAH-.pdf"],"profession":"Psicólogo/a. \r\n\r\n \r\n Unidad Organizativa de destino:  Subsecretaría de Atención Hospitalaria. \r\n\r\n \r\n Régimen horario:  30hs. semanales de labor. \r\n\r\n \r\n Lugar de Inscripción : Rivadavia 524, piso 3°, oficina 323. \r\n\r\n \r\n Horario de Inscripción : 8:00 a 15:00 hs.","specialty":"Psicólogo/a","start":"10/03/2025","start-fix":"2025-03-10","title":"RESOL-2025-35-GCABA-SSAH","url":"https://buenosaires.gob.ar/salud/recursos-humanos/ss-atencion-hospitalaria-98"}
{"end":"21/11/2024","end-fix":"2024-11-21","hospital":"SS Atención Primaria, Ambulatoria y Comunitaria","id_node":"153468","job":"PSICÓLOGO/A DE PLANTA","links":["https://buenosaires.gob.ar/sites/default/files/2024-11/RESOL%20DE%20LLAMADO-RS-2024-371-GCABA-SSAPAC.pdf","https://buenosaires.gob.ar/sites/default/files/2025-02/EXAMEN-RESOL-2025-371-GCABA-SSAPAC.pdf","https://buenosaires.gob.ar/sites/default/files/2025-03/ORDEN%20DE%20MERITO-RESOL-2024-371-GCABA-SSAPAC.pdf","https://buenosaires.gob.ar/sites/default/files/2025-04/RS-2025-16302970-GCABA-SSAPAC.pdf","https://buenosaires.gob.ar/sites/default/files/2025-05/RS-2025-19384611-GCABA-SSAPAC%20%281%29.pdf","https://buenosaires.gob.ar/sites/default/files/2025-06/RS-2025-23878256-GCABA-SSAPAC.pdf","https://buenosaires.gob.ar/sites/default/files/2025-07/RS-2025-30649405-GCABA-SSAPAC.pdf"],"profession":"LIC. EN PSICOLOGÍA","specialty":"Psicólogo/a","start":"12/11 /2024","start-fix":"2024-11-12","title":"RESOL-2024-371-GCABA-SSAPAC","url":"https://buenosaires.gob.ar/salud/recursos-humanos/ss-atencion-primaria-ambulatoria-y-comunitaria-51"}
{"end":"22/11/2024","end-fix":"2024-11-22","hospital":"SS Atención Primaria, Ambulatoria y Comunitaria","id_node":"153468","job":"PSICÓLOGO/A DE PLANTA","links":["https://buenosaires.gob.ar/sites/default/files/2024-10/RESOL%20DE%20LLAMADO-RS-2024-373-GCABA-SSAPAC.pdf","https://buenosaires.gob.ar/sites/default/files/2025-06/IF-2025-EVALUACI%C3%93N-RS-373-GCABA-DGATP.pdf","https://buenosaires.gob.ar/sites/default/files/2025-06/IF-2025-ORDEN%20DE%20MERITO-GCABA-SSAPAC-1.pdf","https://buenosaires.gob.ar/sites/default/files/2025-11/RS-2025-49708784-GCABA-SSAPAC.pdf","https://buenosaires.gob.ar/sites/default/files/2025-11/RS-2025-49835075-GCABA-SSAPAC.pdf"],"profession":"LIC. EN PSICOLOGÍA Unidad Organizativa de destino: CeSAC N° 6 del Área Programática de la zona geográfica de referencia del Hospital Gral. de Agudos P. Piñero Régimen horario: 30 hs. semanales de labor de lunes a viernes, destinando dieciséis (16) horas semanales para asignación de turnos de atención en consultorio programados y espontáneos, ocho (8) horas semanales a disposición del jefe del centro y seis (6) horas para capacitación.","specialty":"Psicólogo/a","start":"13/11/2024","start-fix":"2024-11-13","title":"RESOL-2024-373-GCABA-SSAPAC","url":"https://buenosaires.gob.ar/salud/recursos-humanos/ss-atencion-primaria-ambulatoria-y-comunitaria-51"}
{"end":"28/08/2023","end-fix":"2023-08-28","hospital":"SS Atención Primaria, Ambulatoria y Comunitaria","id_node":"153468","job":"Psicólogo/a de Planta","links":["https://buenosaires.gob.ar/sites/default/files/2024-03/RS-2023-30475137-GCABA-SSAPAC.pdf","https://buenosaires.gob.ar/sites/default/files/2024-03/RS-2023-42455638-GCABA-SSAPAC.pdf","https://buenosaires.gob.ar/sites/default/files/2024-03/IF-2024-12059374-GCABA-DGATP.pdf","https://buenosaires.gob.ar/sites/default/files/2024-05/ORDEN%20DE%20MERITO-RESOL-2023-182-GCABA-SSAPAC.pdf","https://buenosaires.gob.ar/sites/default/files/2024-08/amplia%20227.pdf"],"profession":"Psicólogo/a \r\n\t Orientación : Psicología Clínica","specialty":"Psicólogo/a","start":"17/08/2023","start-fix":"2023-08-17","title":"RS-2023-182-GCABA-SSAPAC","url":"https://buenosaires.gob.ar/salud/recursos-humanos/ss-atencion-primaria-ambulatoria-y-comunitaria-51"}
{"end":"23/02/2024","end-fix":"2024-02-23","hospital":"SS Atención Primaria, Ambulatoria y Comunitaria","id_node":"153468","job":"PSICÓLOGO/A DE PLANTA","links":["https://buenosaires.gob.ar/sites/default/files/2024-04/RS-2024-22-GCABA-SSAPAC%281%29.pdf","https://buenosaires.gob.ar/sites/default/files/2024-04/IF-2024-EVALUACION-GCABA-DGATP%281%29.pdf","https://buenosaires.gob.ar/sites/default/files/2024-05/IF-2024-18183816-GCABA-SSAPAC.pdf","https://buenosaires.gob.ar/sites/default/files/2024-07/RS-2024-AMPLIATORIA-RS-224-GCABA-SSAPAC.pdf","https://buenosaires.gob.ar/sites/default/files/2024-07/IF-2024-27755848-GCABA-SSAPAC.pdf"],"profession":"PSICÓLOGO/A","specialty":"Psicólogo/a","start":": 14/02/2024","start-fix":"2024-02-14","title":"RS-2024-22-GCABA-SSAPAC","url":"https://buenosaires.gob.ar/salud/recursos-humanos/ss-atencion-primaria-ambulatoria-y-comunitaria-51"}
{"end":"21/08/2024","end-fix":"2024-08-21","hospital":"SS Atención Primaria, Ambulatoria y Comunitaria","id_node":"153468","job":"PSICÓLOGO/A DE PLANTA","links":["https://buenosaires.gob.ar/sites/default/files/2024-07/RS-2024-27648981-GCABA-SSAPAC.pdf","https://buenosaires.gob.ar/sites/default/files/2024-10/EXAMEN-RESOL-2024-241-GCABA-SSAPAC.pdf","https://buenosaires.gob.ar/sites/default/files/2024-10/ORDEN%20DE%20MERITO-RESOL-2024-241-GCABA-SSAPAC.pdf","https://buenosaires.gob.ar/sites/default/files/2024-12/RESOL%20AMPL-RS-2024-241-GCABA-SSAPAC.pdf","https://buenosaires.gob.ar/sites/default/files/2025-03/AMPLIACI%C3%93N-RS-2024-241-GCABA-SSAPAC.pdf"],"profession":"PSICÓLOGO/A \r\n\t Orientación:  INFANTO JUVENIL","specialty":"Psicólogo/a","start":"12/08/2024","start-fix":"2024-08-12","title":"RS-2024-241-GCABA-SSAPAC","url":"https://buenosaires.gob.ar/salud/recursos-humanos/ss-atencion-primaria-ambulatoria-y-comunitaria-51"}
{"end":"28/10/2024","end-fix":"2024-10-28","hospital":"SS Atención Primaria, Ambulatoria y Comunitaria","id_node":"153468","job":"PSICÓLOGO/A DE PLANTA","links":["https://buenosaires.gob.ar/sites/default/files/2024-10/RS-2024-318-GCABA-SSAPAC.pdf","https://buenosaires.gob.ar/sites/default/files/2024-11/IF-2024-43828052-GCABA-DGATP.pdf","https://buenosaires.gob.ar/sites/default/files/2024-12/IF-2024-46682888-GCABA-SSAPAC.pdf"],"profession":"LIC. EN PSICÓLOGÍA","specialty":"Psicólogo/a","start":"17/10/2024","start-fix":"2024-10-17","title":"RS-2024-318-GCABA-SSAPAC","url":"https://buenosaires.gob.ar/salud/recursos-humanos/ss-atencion-primaria-ambulatoria-y-comunitaria-51"}
{"end":"27/11/2024","end-fix":"2024-11-27","hospital":"SS Atención Primaria, Ambulatoria y Comunitaria","id_node":"153468","job":"PSICÓLOGO/A DE PLANTA","links":["https://buenosaires.gob.ar/sites/default/files/2024-11/RS-2024-41371665-GCABA-SSAPAC%20%284%29.pdf","https://buenosaires.gob.ar/sites/default/files/2024-11/RS-2024-43944765-GCABA-SSAPAC.pdf","https://buenosaires.gob.ar/sites/default/files/2025-04/IF-2025-14365199-GCABA-DGATP.pdf","https://buenosaires.gob.ar/sites/default/files/2025-05/IF-2025-20065371-GCABA-SSAPAC.pdf","https://buenosaires.gob.ar/sites/default/files/2025-05/RS-2025-21966958-GCABA-SSAPAC.pdf","https://buenosaires.gob.ar/sites/default/files/2025-08/RS-2025-33697036-GCABA-SSAPAC%20%281%29.pdf"],"profession":"LIC. EN PSICOLOGÍA \r\n\r\n Orientación:  INFANTO JUVENIL","specialty":"Psicólogo/a","start":"13/11/2024","start-fix":"2024-11-13","title":"RS-2024-380-GCABA-SSAPAC","url":"https://buenosaires.gob.ar/salud/recursos-humanos/ss-atencion-primaria-ambulatoria-y-comunitaria-51"}
{"end":"17/07/2025","end-fix":"2025-07-17","hospital":"SS Atención Primaria, Ambulatoria y Comunitaria","id_node":"153468","job":"PSICÓLOGO/A DE PLANTA","links":["https://buenosaires.gob.ar/sites/default/files/2025-07/RS-2025-191-GCABA-SSAPAC.pdf","https://buenosaires.gob.ar/sites/default/files/2025-09/ORDEN%20DE%20MERITO-RESOL-2025-191-GCABA-SSAPAC.pdf"],"profession":null,"specialty":"Psicólogo/a","start":"07/07/2025","start-fix":"2025-07-07","title":"RS-2025-191-GCABA-SSAPAC","url":"https://buenosaires.gob.ar/salud/recursos-humanos/ss-atencion-primaria-ambulatoria-y-comunitaria-51"}
{"end":"18/03/2025","end-fix":"2025-03-18","hospital":"SS Atención Primaria, Ambulatoria y Comunitaria","id_node":"153468","job":"PSICÓLOGO/A DE PLANTA","links":["https://buenosaires.gob.ar/sites/default/files/2025-02/RS-2025-08786760-GCABA-SSAPAC.pdf","https://buenosaires.gob.ar/sites/default/files/2025-08/IF-2025-32334996-GCABA-SSAPAC.pdf","https://buenosaires.gob.ar/sites/default/files/2025-09/ORDEN%20DE%20MERITO-DI-2025-67-GCABA-SSAPAC.pdf","https://buenosaires.gob.ar/sites/default/files/2025-10/RS-2025-AMPLIATORIA-309-GCABA-SSAPAC-1.pdf"],"profession":"LIC. EN PSICOLOGÍA \r\n\r\n Unidad Organizativa de destino: CESAC N° 42 del Área Programática de la zona geográfica de referencia del Hospital Gral. De Agudos Dr. C. Durand - Subsecretaría de Atención Primaria, Ambulatoria y Comunitaria","specialty":"Psicólogo/a","start":"07/03/2025","start-fix":"2025-03-07","title":"RS-2025-67-GCABA-SSAPAC","url":"https://buenosaires.gob.ar/salud/recursos-humanos/ss-atencion-primaria-ambulatoria-y-comunitaria-51"}
